Automated.name	clean_annotation_name	clean_annotation_name_fixed	Plot_Module	Label_Name	module
c105492-g1 1-to-3 PARD6A,PARD6G,PARD6B par-6 family cell polarity regulator alpha	PARD6A,PARD6G,PARD6B	PARD6A,PARD6G,PARD6B	TRUE	FALSE	Rho signaling
c93195-g1 1-to-1 MSH6 mutS homolog 6	NA	NA	FALSE	FALSE	Regulation of cell cycle
c104232-g1 1-to-3 MTA2,MTA1,MTA3 metastasis associated 1 family member 2	NA	NA	FALSE	FALSE	Regulation of cell cycle
c100830-g1 1-to-1 MTHFR methylenetetrahydrofolate reductase	NA	NA	FALSE	FALSE	Metabolism
c103848-g1 2-to-1 MUSK muscle associated receptor tyrosine kinase	NA	NA	TRUE	FALSE	Actomyosin contractility
c103848-g1 2-to-1 MUSK muscle associated receptor tyrosine kinase	NA	NA	TRUE	FALSE	Differentiation (muscle cell related)
c103848-g1 2-to-1 MUSK muscle associated receptor tyrosine kinase	NA	NA	TRUE	FALSE	Post-synaptic scaffold
c103848-g1 2-to-1 MUSK muscle associated receptor tyrosine kinase	NA	NA	TRUE	FALSE	Regulation of adhesion complexes
c100226-g1 MYCN (v-myc myelocytomatosis viral related oncogene, neuroblastoma derived (avian)) - emapper OG	NA	NA	FALSE	FALSE	Regulation of cell cycle
c91412-g1 1-to-2 MYO3A,MYO3B myosin IIIA	NA	NA	FALSE	FALSE	Regulation of ciliary function
c108134-g1 1-to-2 PPP1R16A,PPP1R16B protein phosphatase 1 regulatory subunit 16A	PPP1R16A,PPP1R16B	PPP1R16A,PPP1R16B	TRUE	TRUE	Actomyosin contractility
c108134-g1 1-to-2 PPP1R16A,PPP1R16B protein phosphatase 1 regulatory subunit 16A	PPP1R16A,PPP1R16B	PPP1R16A,PPP1R16B	TRUE	TRUE	GPCR signaling
c108134-g1 1-to-2 PPP1R16A,PPP1R16B protein phosphatase 1 regulatory subunit 16A	PPP1R16A,PPP1R16B	PPP1R16A,PPP1R16B	TRUE	TRUE	RhoA GTPase signaling
c108134-g1 1-to-2 PPP1R16A,PPP1R16B protein phosphatase 1 regulatory subunit 16A	PPP1R16A,PPP1R16B	PPP1R16A,PPP1R16B	TRUE	TRUE	Rho signaling
c108332-g1 1-to-1 VPS13D vacuolar protein sorting 13 homolog D	VPS13D	VPS13D	TRUE	FALSE	Phospholipid signaling
c108332-g1 1-to-1 VPS13D vacuolar protein sorting 13 homolog D	VPS13D	VPS13D	TRUE	FALSE	Vesicular trafficking
c110092-g1 3-to-4 HMGB2,HMGB1,HMGB3,HMGB4 high mobility group box 2	HMGB2,HMGB1,HMGB3,HMGB4	HMGB2,HMGB1,HMGB3,HMGB4	FALSE	FALSE	Chaperone
c110092-g1 3-to-4 HMGB2,HMGB1,HMGB3,HMGB4 high mobility group box 2	HMGB2,HMGB1,HMGB3,HMGB4	HMGB2,HMGB1,HMGB3,HMGB4	FALSE	FALSE	Regulation of inflammation
c110149-g1 1-to-3 KIF5B,KIF5C,KIF5A kinesin family member 5B	KIF5B,KIF5C,KIF5A	KIF5B,KIF5C,KIF5A	FALSE	FALSE	Microtubule dynamics
c110149-g1 1-to-3 KIF5B,KIF5C,KIF5A kinesin family member 5B	KIF5B,KIF5C,KIF5A	KIF5B,KIF5C,KIF5A	FALSE	FALSE	Vesicular trafficking
c104650-g2 2-to-3 MYOF,DYSF myoferlin	NA	NA	TRUE	FALSE	Differentiation (muscle cell related)
c104650-g2 2-to-3 MYOF,DYSF myoferlin	NA	NA	TRUE	FALSE	Phospholipid signaling
c104650-g2 2-to-3 MYOF,DYSF myoferlin	NA	NA	TRUE	FALSE	Vesicular trafficking
c110956-g1 RDX (Neurofibromin 2 (Merlin)) - emapper OG	RDX	RDX	TRUE	TRUE	Regulation of adhesion complexes
c110956-g1 RDX (Neurofibromin 2 (Merlin)) - emapper OG	RDX	RDX	TRUE	TRUE	Regulation of cytoskeleton at the membrane
c102126-g1 NANOS1 (nanos homolog 1 (Drosophila)) - emapper OG	NA	NA	FALSE	FALSE	Differentiation (reproductive cell related)
c111555-g1 hs-SH2D6,SOCS1	SH2D6,SOCS1	SH2D6,SOCS1	FALSE	FALSE	Regulation of inflammation
c83720-g1 NCF4 (Neutrophil cytosolic factor 4, 40kDa) - emapper OG	NA	NA	TRUE	FALSE	NO signaling
c104131-g2 2-to-2 NEDD4L,NEDD4 neural precursor cell expressed, developmentally down-regulated 4-like, E3 ubiq	NA	NA	FALSE	FALSE	Regulation of calcium signaling
c104184-g1 1-to-3 NEK5,NEK1,NEK3 NIMA related kinase 5	NA	NA	FALSE	FALSE	Regulation of cell cycle
c104017-g3 1-to-2 NEK7,NEK6 NIMA related kinase 7	NA	NA	FALSE	FALSE	Regulation of cell cycle
c88297-g1 1-to-1 NELFA negative elongation factor complex member A	NA	NA	FALSE	FALSE	RNA processing
c103991-g1 (neuron navigator) - emapper OG	NA	NA	TRUE	FALSE	Actin network assembly
c103991-g1 (neuron navigator) - emapper OG	NA	NA	TRUE	FALSE	Microtubule dynamics
c103991-g1 (neuron navigator) - emapper OG	NA	NA	TRUE	FALSE	Rac1 GTPase signaling
c103991-g1 (neuron navigator) - emapper OG	NA	NA	TRUE	FALSE	RhoA GTPase signaling
c2276-g1 RPL18A (60S ribosomal protein L18a) - emapper OG	RPL18A	RPL18A	FALSE	FALSE	RNA processing
c102239-g1 1-to-1 NFRKB nuclear factor related to kappaB binding protein	NA	NA	TRUE	FALSE	Regulation of inflammation
c102239-g1 1-to-1 NFRKB nuclear factor related to kappaB binding protein	NA	NA	TRUE	FALSE	Stress-related transcription activity
c2711-g1 RPL18 (60S ribosomal protein L18) - emapper OG	RPL18	RPL18	FALSE	FALSE	RNA processing
c104670-g4 1-to-1 NOS1AP nitric oxide synthase 1 adaptor protein	NA	NA	TRUE	FALSE	NO signaling
c104590-g2 NOTCH2 (neurogenic locus notch homolog protein) - emapper OG	NA	NA	FALSE	FALSE	Regulation of adhesion complexes
c104682-g1 1-to-1 NSF N-ethylmaleimide sensitive factor, vesicle fusing ATPase	NA	NA	FALSE	FALSE	Vesicular trafficking
c100540-g1 1-to-1 ODF2 outer dense fiber of sperm tails 2	NA	NA	FALSE	FALSE	Regulation of ciliary function
c97214-g1 P, Rabies virus (strain Pasteur vaccins / PV)	NA	NA	FALSE	FALSE	Vesicular trafficking
c103994-g2 1-to-1 PARP3 poly(ADP-ribose) polymerase family member 3	NA	NA	FALSE	FALSE	Regulation of cell cycle
c53310-g1 1-to-11 PCDHB2,PCDHB5,PCDH12,PCDHB12... protocadherin beta 2	NA	NA	TRUE	FALSE	Regulation of adhesion complexes
c53310-g1 1-to-11 PCDHB2,PCDHB5,PCDH12,PCDHB12... protocadherin beta 2	NA	NA	TRUE	FALSE	Regulation of cytoskeleton at the membrane
c104803-g1 PCSK5 (proprotein convertase subtilisin/kexin type 5) - blastp	NA	NA	TRUE	FALSE	Exocytosis
c104803-g1 PCSK5 (proprotein convertase subtilisin/kexin type 5) - blastp	NA	NA	TRUE	FALSE	Vesicular trafficking
c102545-g1 1-to-3 PELI2,PELI3,PELI1 pellino E3 ubiquitin protein ligase family member 2	NA	NA	FALSE	FALSE	JNK/p38 MAPK signaling
c102545-g1 1-to-3 PELI2,PELI3,PELI1 pellino E3 ubiquitin protein ligase family member 2	NA	NA	FALSE	FALSE	Regulation of inflammation
c52446-g1 1-to-1 MAP3K20 mitogen-activated protein kinase kinase kinase 20	MAP3K20	MAP3K20	FALSE	FALSE	JNK/p38 MAPK signaling
c98374-g1 (peptidoglycan catabolic process) - emapper OG	NA	NA	FALSE	FALSE	Regulation of adhesion complexes
c102529-g5 PEX1 (Peroxisome biogenesis factor 1, N-terminal) - emapper OG	NA	NA	FALSE	FALSE	NO signaling
c99432-g1 (PH) - emapper OG	NA	NA	FALSE	FALSE	Regulation of cytoskeleton at the membrane
c104558-g2 (PH domain) - emapper OG	NA	NA	FALSE	FALSE	Regulation of cytoskeleton at the membrane
c92759-g1 1-to-2 PHLPP1,PHLPP2 PH domain and leucine rich repeat protein phosphatase 1	NA	NA	FALSE	FALSE	Differentiation (muscle cell related)
c63803-g1 EEF1D (Eukaryotic translation elongation factor 1 delta (Guanine nucleotide exchange protein)) - ema	EEF1D	EEF1D	FALSE	FALSE	RNA processing
c103840-g1 1-to-3 PIK3C2A,PIK3C2B,PIK3C2G phosphatidylinositol-4-phosphate 3-kinase catalytic subunit type 2 a	NA	NA	TRUE	FALSE	Phospholipid signaling
c104815-g1 PINK1 (PTEN induced putative kinase 1) - blastp	NA	NA	FALSE	FALSE	NO signaling
c6850-g1 1-to-1 UFL1 UFM1 specific ligase 1	UFL1	UFL1	FALSE	FALSE	Regulation of inflammation
c74224-g2 1-to-1 PASK PAS domain containing serine/threonine kinase	PASK	PASK	FALSE	FALSE	Differentiation (muscle cell related)
c74224-g2 1-to-1 PASK PAS domain containing serine/threonine kinase	PASK	PASK	FALSE	FALSE	Metabolism
c74224-g2 1-to-1 PASK PAS domain containing serine/threonine kinase	PASK	PASK	FALSE	FALSE	Phospholipid signaling
c101462-g1 1-to-1 PKHD1 PKHD1, fibrocystin/polyductin	NA	NA	FALSE	FALSE	Regulation of adhesion complexes
c101462-g1 1-to-1 PKHD1 PKHD1, fibrocystin/polyductin	NA	NA	FALSE	FALSE	Regulation of ciliary function
c102868-g2 PLA2G6 (phospholipase A2 group VI) - blastp	NA	NA	TRUE	FALSE	Phospholipid signaling
c104750-g1 4-to-1 PLA2G6 phospholipase A2 group VI	NA	NA	FALSE	FALSE	Phospholipid signaling
c79296-g1 1-to-4 CORO1A,CORO6,CORO1B,CORO1C coronin 1A	CORO1A,CORO6,CORO1B,CORO1C	CORO1A,CORO6,CORO1B,CORO1C	TRUE	TRUE	Actin dynamics
c79296-g1 1-to-4 CORO1A,CORO6,CORO1B,CORO1C coronin 1A	CORO1A,CORO6,CORO1B,CORO1C	CORO1A,CORO6,CORO1B,CORO1C	TRUE	TRUE	Actin network assembly
c93327-g1 1-to-2 PLEKHG6,PLEKHG5 pleckstrin homology and RhoGEF domain containing G6	NA	NA	FALSE	FALSE	Regulation of cytoskeleton at the membrane
c80239-g1 1-to-1 TBCE tubulin folding cofactor E	TBCE	TBCE	FALSE	FALSE	Microtubule dynamics
c53306-g1 PLEKHH1 (pleckstrin homology, MyTH4 and FERM domain containing H1) - blastp	NA	NA	FALSE	FALSE	Regulation of cytoskeleton at the membrane
c80807-g1 HPS4 (Hermansky-Pudlak Syndrome 4) - emapper OG	HPS4	HPS4	FALSE	FALSE	Lysosomes
c80807-g1 HPS4 (Hermansky-Pudlak Syndrome 4) - emapper OG	HPS4	HPS4	FALSE	FALSE	Vesicular trafficking
c101348-g1 pmp12, Chlamydia pneumoniae	NA	NA	FALSE	FALSE	Regulation of adhesion complexes
c81272-g1 hs-N4BP3,C3orf49,GKAP1	N4BP3,C3orf49,GKAP1	N4BP3,C3orf49,GKAP1	FALSE	FALSE	Regulation of inflammation
c97114-g1 pob1, Schizosaccharomyces pombe (strain 972 / ATCC..	NA	NA	FALSE	FALSE	Cdc42 GTPase signaling
c81748-g1 POG1, Vanderwaltozyma polyspora (strain ATCC 22028..	POG1,	POG1	FALSE	FALSE	Regulation of cell cycle
c82132-g1 1-to-1 PRIM2 primase (DNA) subunit 2	PRIM2	PRIM2	FALSE	FALSE	Regulation of cell cycle
c82928-g1 1-to-1 DIS3 DIS3 homolog, exosome endoribonuclease and 3'-5' exoribonuclease	DIS3	DIS3	FALSE	FALSE	RNA processing
c83238-g1 1-to-2 CHUK,IKBKB conserved helix-loop-helix ubiquitous kinase	CHUK,IKBKB	CHUK,IKBKB	FALSE	FALSE	Regulation of inflammation
c97997-g1 1-to-1 PPP1R2 protein phosphatase 1 regulatory inhibitor subunit 2	NA	NA	TRUE	FALSE	Regulation of cytoskeleton at the membrane
c50918-g1 1-to-1 PPP4R4 protein phosphatase 4 regulatory subunit 4	NA	NA	FALSE	FALSE	Regulation of cell cycle
c99115-g1 1-to-2 PRKAA1,PRKAA2 protein kinase AMP-activated catalytic subunit alpha 1	NA	NA	FALSE	FALSE	Metabolism
c99115-g1 1-to-2 PRKAA1,PRKAA2 protein kinase AMP-activated catalytic subunit alpha 1	NA	NA	FALSE	FALSE	NO signaling
c102902-g1 1-to-3 PRKCG,PRKCB,PRKCA protein kinase C gamma	NA	NA	FALSE	FALSE	Differentiation (gland cell related)
c102902-g1 1-to-3 PRKCG,PRKCB,PRKCA protein kinase C gamma	NA	NA	FALSE	FALSE	Regulation of calcium signaling
c85861-g1 1-to-2 MSI1,MSI2 musashi RNA binding protein 1	MSI1,MSI2	MSI1,MSI2	FALSE	FALSE	Differentiation of spicule cells
c85861-g1 1-to-2 MSI1,MSI2 musashi RNA binding protein 1	MSI1,MSI2	MSI1,MSI2	FALSE	FALSE	RNA processing
c103726-g1 1-to-3 PRKD1,PRKD3,PRKD2 protein kinase D1	NA	NA	FALSE	FALSE	JNK/p38 MAPK signaling
c103726-g1 1-to-3 PRKD1,PRKD3,PRKD2 protein kinase D1	NA	NA	FALSE	FALSE	Phospholipid signaling
c91489-g1 1-to-1 PRR11 proline rich 11	NA	NA	FALSE	FALSE	Regulation of cell cycle
c102046-g1 PTPN13 (protein tyrosine phosphatase, non-receptor type 13 (APO-1 CD95 (Fas)-associated phosphatase	NA	NA	FALSE	FALSE	Apoptosis
c94893-g3 PTPN13 (protein tyrosine phosphatase, non-receptor type 13 (APO-1/CD95 (Fas)-associated phosphatase)	NA	NA	FALSE	FALSE	Apoptosis
c88045-g1 1-to-1 PCCB propionyl-CoA carboxylase beta subunit	PCCB	PCCB	FALSE	FALSE	Metabolism
c88045-g1 1-to-1 PCCB propionyl-CoA carboxylase beta subunit	PCCB	PCCB	FALSE	FALSE	Phospholipid signaling
c88072-g1 1-to-2 FAM109B,FAM109A family with sequence similarity 109 member B	FAM109B,FAM109A	FAM109B,FAM109A	FALSE	FALSE	Vesicular trafficking
c103280-g1 1-to-2 PTPN14,PTPN21 protein tyrosine phosphatase, non-receptor type 14	NA	NA	FALSE	FALSE	Regulation of adhesion complexes
c88176-g1 1-to-1 SNAP29 synaptosome associated protein 29	SNAP29	SNAP29	TRUE	TRUE	Exocytosis
c88176-g1 1-to-1 SNAP29 synaptosome associated protein 29	SNAP29	SNAP29	TRUE	TRUE	Vesicular trafficking
c104843-g1 PtprK/M/T/U family ortholog	NA	NA	FALSE	FALSE	Regulation of adhesion complexes
c88339-g1 1-to-1 PIK3CG phosphatidylinositol-4,5-bisphosphate 3-kinase catalytic subunit gamma	PIK3CG	PIK3CG	TRUE	TRUE	GPCR signaling
c88339-g1 1-to-1 PIK3CG phosphatidylinositol-4,5-bisphosphate 3-kinase catalytic subunit gamma	PIK3CG	PIK3CG	TRUE	TRUE	Phospholipid signaling
c88339-g1 1-to-1 PIK3CG phosphatidylinositol-4,5-bisphosphate 3-kinase catalytic subunit gamma	PIK3CG	PIK3CG	TRUE	TRUE	PI3K signaling
c88339-g1 1-to-1 PIK3CG phosphatidylinositol-4,5-bisphosphate 3-kinase catalytic subunit gamma	PIK3CG	PIK3CG	TRUE	TRUE	Rac1 GTPase signaling
c88339-g1 1-to-1 PIK3CG phosphatidylinositol-4,5-bisphosphate 3-kinase catalytic subunit gamma	PIK3CG	PIK3CG	TRUE	TRUE	Rho signaling
c89095-g2 1-to-1 CHAF1A chromatin assembly factor 1 subunit A	CHAF1A	CHAF1A	FALSE	FALSE	Regulation of cell cycle
c89142-g1 1-to-1 NADK NAD kinase	NADK	NADK	TRUE	FALSE	Metabolism
c89142-g1 1-to-1 NADK NAD kinase	NADK	NADK	TRUE	FALSE	NO signaling
c103174-g1 1-to-2 RAB11FIP3,RAB11FIP4 RAB11 family interacting protein 3	NA	NA	FALSE	FALSE	Vesicular trafficking
c86189-g1 RADIL (Ras association and DIL domains) - blastp	NA	NA	FALSE	FALSE	Ras GTPase signaling
c102941-g2 1-to-1 RALBP1 ralA binding protein 1	NA	NA	FALSE	FALSE	Cdc42 GTPase signaling
c102941-g2 1-to-1 RALBP1 ralA binding protein 1	NA	NA	FALSE	FALSE	Rac1 GTPase signaling
c90333-g1 1-to-2 RNF103-CHMP3 RNF103-CHMP3 readthrough	RNF103-CHMP3	RNF103-CHMP3	FALSE	FALSE	Lysosomes
c90333-g1 1-to-2 RNF103-CHMP3 RNF103-CHMP3 readthrough	RNF103-CHMP3	RNF103-CHMP3	FALSE	FALSE	Vesicular trafficking
c90745-g2 (Inherit from opiNOG: glycine-rich RNA binding protein) - emapper OG	glycine-richRNAbindingprotein	glycine-richRNAbindingprotein	FALSE	FALSE	RNA processing
c95279-g1 RALGPS2 (Ral GEF with PH domain and SH3 binding motif) - emapper OG	NA	NA	FALSE	FALSE	Regulation of cytoskeleton at the membrane
c91370-g1 ATP6V1H (ATPase, H transporting, lysosomal 50 57kDa, V1 subunit H) - emapper OG	ATP6V1H	ATP6V1H	FALSE	FALSE	Lysosomal transporter
c102213-g1 2-to-4 RAPGEFL1,RAPGEF5,RAPGEF4,RAPGEF3 Rap guanine nucleotide exchange factor like 1	NA	NA	FALSE	FALSE	Regulation of adhesion complexes
c91395-g1 1-to-2 CLASP1,CLASP2 cytoplasmic linker associated protein 1	CLASP1,CLASP2	CLASP1,CLASP2	FALSE	FALSE	Microtubule dynamics
c101097-g1 RASGEF1B (RasGEF domain family member 1B) - blastp	NA	NA	FALSE	FALSE	Regulation of inflammation
c99229-g1 1-to-1 RBM45 RNA binding motif protein 45	NA	NA	FALSE	FALSE	Differentiation (gland cell related)
c91434-g1 SRR (serine racemase) - emapper OG	SRR	SRR	FALSE	FALSE	Metabolism
c91449-g1 EEF2 (Eukaryotic translation elongation factor 2) - emapper OG	EEF2	EEF2	FALSE	FALSE	RNA processing
c104337-g1 1-to-1 RFWD2 ring finger and WD repeat domain 2	NA	NA	FALSE	FALSE	Metabolism
c91485-g1 (Inherit from KOG: Pleckstrin homology domain containing, family H (With MyTH4 domain) member) - ema	Pleckstrinhomologydomaincontaining,familyHWithMyTH4domain	Pleckstrinhomologydomaincontaining,familyHWithMyTH4domain	TRUE	FALSE	Regulation of adhesion complexes
c91485-g1 (Inherit from KOG: Pleckstrin homology domain containing, family H (With MyTH4 domain) member) - ema	Pleckstrinhomologydomaincontaining,familyHWithMyTH4domain	Pleckstrinhomologydomaincontaining,familyHWithMyTH4domain	TRUE	FALSE	Regulation of cytoskeleton at the membrane
c100915-g1 RGS4 (regulator of G-protein signaling 4) - emapper OG	NA	NA	FALSE	FALSE	GPCR signaling
c91679-g1 RPL21 (ribosomal protein L21) - emapper OG	RPL21	RPL21	FALSE	FALSE	RNA processing
c91856-g2 2-to-3 IQSEC2,IQSEC3,IQSEC1 IQ motif and Sec7 domain 2	IQSEC2,IQSEC3,IQSEC1	IQSEC2,IQSEC3,IQSEC1	FALSE	FALSE	Vesicular trafficking
c101434-g1 1-to-5 RHCG,RHCE,RHD,RHAG... Rh family C glycoprotein	NA	NA	FALSE	FALSE	Metabolism
c91960-g1 1-to-1 CCDC115 coiled-coil domain containing 115	CCDC115	CCDC115	FALSE	FALSE	Vesicular trafficking
c101336-g2 (Inherit from KOG: rho guanine nucleotide exchange factor) - emapper OG	NA	NA	FALSE	FALSE	Rho signaling
c99144-g2 RIMBP2 (RIMS binding protein 2) - blastp	NA	NA	FALSE	FALSE	Exocytosis
c99144-g2 RIMBP2 (RIMS binding protein 2) - blastp	NA	NA	FALSE	FALSE	Regulation of calcium signaling
c99144-g2 RIMBP2 (RIMS binding protein 2) - blastp	NA	NA	FALSE	FALSE	Vesicular trafficking
c92415-g1 hs-SEC61B	SEC61B	SEC61B	FALSE	FALSE	Vesicular trafficking
c92647-g1 1-to-1 CCT5 chaperonin containing TCP1 subunit 5	CCT5	CCT5	FALSE	FALSE	Actin dynamics
c92647-g1 1-to-1 CCT5 chaperonin containing TCP1 subunit 5	CCT5	CCT5	FALSE	FALSE	Chaperone
c92647-g1 1-to-1 CCT5 chaperonin containing TCP1 subunit 5	CCT5	CCT5	FALSE	FALSE	Microtubule dynamics
c92709-g1 1-to-1 RAB18 RAB18, member RAS oncogene family	RAB18	RAB18	FALSE	FALSE	Vesicular trafficking
c92727-g1 (7 transmembrane receptor (rhodopsin family)) - emapper OG	7transmembranereceptorrhodopsinfamily	7transmembranereceptorrhodopsinfamily	TRUE	TRUE	GPCR signaling
c104270-g1 RNF10 (Ring finger protein 10) - emapper OG	NA	NA	FALSE	FALSE	Regulation of inflammation
c104270-g1 RNF10 (Ring finger protein 10) - emapper OG	NA	NA	FALSE	FALSE	Vesicular trafficking
c104629-g1 RNF14 (ring finger protein 14) - blastp	NA	NA	FALSE	FALSE	Regulation of inflammation
c104629-g1 RNF14 (ring finger protein 14) - blastp	NA	NA	FALSE	FALSE	Vesicular trafficking
c102686-g1 1-to-1 RNF31 ring finger protein 31	NA	NA	FALSE	FALSE	Regulation of inflammation
c102686-g1 1-to-1 RNF31 ring finger protein 31	NA	NA	FALSE	FALSE	Vesicular trafficking
c103496-g1 1-to-1 RNF41 ring finger protein 41	NA	NA	FALSE	FALSE	Regulation of inflammation
c103496-g1 1-to-1 RNF41 ring finger protein 41	NA	NA	FALSE	FALSE	Vesicular trafficking
c93637-g1 1-to-3 ELMSAN1,ZNF541,TRERF1 ELM2 and Myb/SANT domain containing 1	ELMSAN1,ZNF541,TRERF1	ELMSAN1,ZNF541,TRERF1	FALSE	FALSE	Regulation of cell cycle
c103029-g2 1-to-2 RPGRIP1L,RPGRIP1 RPGRIP1 like	NA	NA	FALSE	FALSE	Regulation of ciliary function
c101413-g1 1-to-4 RPS6KA6,RPS6KA3,RPS6KA2,RPS6KA1 ribosomal protein S6 kinase A6	NA	NA	FALSE	FALSE	RNA processing
c94114-g1 1-to-1 TRAPPC9 trafficking protein particle complex 9	TRAPPC9	TRAPPC9	FALSE	FALSE	Regulation of inflammation
c94114-g1 1-to-1 TRAPPC9 trafficking protein particle complex 9	TRAPPC9	TRAPPC9	FALSE	FALSE	Vesicular trafficking
c94205-g1 1-to-8 AGAP1,AGAP5,AGAP3,AGAP9... ArfGAP with GTPase domain, ankyrin repeat and PH domain 1	AGAP1,AGAP5,AGAP3,AGAP9...	AGAP1,AGAP5,AGAP3,AGAP9...	FALSE	FALSE	Vesicular trafficking
c102407-g1 1-to-1 RSRC2 arginine and serine rich coiled-coil 2	NA	NA	FALSE	FALSE	Regulation of cell cycle
c94604-g1 1-to-3 ABI3,ABI2,ABI1 ABI family member 3	ABI3,ABI2,ABI1	ABI3,ABI2,ABI1	TRUE	FALSE	Actin network assembly
c94604-g1 1-to-3 ABI3,ABI2,ABI1 ABI family member 3	ABI3,ABI2,ABI1	ABI3,ABI2,ABI1	TRUE	FALSE	Cdc42 GTPase signaling
c94604-g1 1-to-3 ABI3,ABI2,ABI1 ABI family member 3	ABI3,ABI2,ABI1	ABI3,ABI2,ABI1	TRUE	FALSE	Rac1 GTPase signaling
c94604-g1 1-to-3 ABI3,ABI2,ABI1 ABI family member 3	ABI3,ABI2,ABI1	ABI3,ABI2,ABI1	TRUE	FALSE	Rho signaling
c102173-g1 1-to-1 RTF1 RTF1 homolog, Paf1/RNA polymerase II complex component	NA	NA	FALSE	FALSE	Regulation of cell cycle
c94614-g1 hs-ITGB1BP1,PID1	ITGB1BP1,PID1	ITGB1BP1,PID1	TRUE	FALSE	Regulation of adhesion complexes
c103625-g2 1-to-1 RUNDC1 RUN domain containing 1	NA	NA	FALSE	FALSE	Lysosomes
c103625-g2 1-to-1 RUNDC1 RUN domain containing 1	NA	NA	FALSE	FALSE	Vesicular trafficking
c100709-g1 1-to-2 SAXO2,SAXO1 stabilizer of axonemal microtubules 2	NA	NA	FALSE	FALSE	Microtubule dynamics
c100709-g1 1-to-2 SAXO2,SAXO1 stabilizer of axonemal microtubules 2	NA	NA	FALSE	FALSE	Regulation of ciliary function
c102914-g1 1-to-1 SCAP SREBF chaperone	NA	NA	FALSE	FALSE	Phospholipid signaling
c104659-g1 2-to-5 SEC14L3,SEC14L4,SEC14L6,AC004832.3... SEC14 like lipid binding 3	NA	NA	FALSE	FALSE	Vesicular trafficking
c94792-g1 hs-MSRB2,MSRB3	MSRB2,MSRB3	MSRB2,MSRB3	FALSE	FALSE	NO signaling
c94867-g1 ARCN1 (Archain 1) - emapper OG	ARCN1	ARCN1	FALSE	FALSE	Vesicular trafficking
c104633-g1 1-to-2 SEC31B,SEC31A SEC31 homolog B, COPII coat complex component	NA	NA	FALSE	FALSE	Vesicular trafficking
c94974-g1 hs-CDC42EP1	CDC42EP1	CDC42EP1	TRUE	TRUE	Cdc42 GTPase signaling
c94974-g1 hs-CDC42EP1	CDC42EP1	CDC42EP1	TRUE	TRUE	Regulation of cytoskeleton at the membrane
c94974-g1 hs-CDC42EP1	CDC42EP1	CDC42EP1	TRUE	TRUE	Rho signaling
c103046-g2 1-to-1 SEC62 SEC62 homolog, preprotein translocation factor	NA	NA	FALSE	FALSE	Vesicular trafficking
c95151-g1 RNF17 (RING finger protein 17) - emapper OG	RNF17	RNF17	FALSE	FALSE	RNA processing
c95204-g1 1-to-1 DEPTOR DEP domain containing MTOR interacting protein	DEPTOR	DEPTOR	TRUE	TRUE	Lysosomes
c95204-g1 1-to-1 DEPTOR DEP domain containing MTOR interacting protein	DEPTOR	DEPTOR	TRUE	TRUE	MTORC2 signaling
c95234-g1 2-to-2 SLC27A1,SLC27A4 solute carrier family 27 member 1	SLC27A1,SLC27A4	SLC27A1,SLC27A4	FALSE	FALSE	Plasma membrane transporter
c95282-g1 1-to-3 LPIN2,LPIN3,LPIN1 lipin 2	LPIN2,LPIN3,LPIN1	LPIN2,LPIN3,LPIN1	FALSE	FALSE	Phospholipid signaling
c95308-g1 1-to-3 CDK2,CDK3,CDK3 cyclin dependent kinase 2	CDK2,CDK3,CDK3	CDK2,CDK3,CDK3	FALSE	FALSE	Regulation of cell cycle
c104030-g2 1-to-1 SF3B2 splicing factor 3b subunit 2	NA	NA	FALSE	FALSE	RNA processing
c95437-g1 1-to-3 FMNL2,FMNL1,FMNL3 formin like 2	FMNL2,FMNL1,FMNL3	FMNL2,FMNL1,FMNL3	TRUE	FALSE	Actin dynamics
c99214-g1 3-to-2 SLC25A2,SLC25A15 solute carrier family 25 member 2	NA	NA	FALSE	FALSE	Plasma membrane transporter
c101847-g1 5-to-9 SLC26A4,SLC26A2,SLC26A5,SLC26A7... solute carrier family 26 member 4	NA	NA	FALSE	FALSE	Plasma membrane transporter
c95660-g3 1-to-1 TRAPPC12 trafficking protein particle complex 12	TRAPPC12	TRAPPC12	FALSE	FALSE	Vesicular trafficking
c95662-g1 AIMP1 (complex-interacting multifunctional protein) - emapper OG	AIMP1	AIMP1	FALSE	FALSE	RNA processing
c100878-g3 SLC26A5 (solute carrier family 26) - emapper OG	NA	NA	FALSE	FALSE	Plasma membrane transporter
c98223-g1 3-to-1 SLC39A14 solute carrier family 39 member 14	NA	NA	FALSE	FALSE	Plasma membrane transporter
c95770-g1 1-to-1 DAP death associated protein	DAP	DAP	FALSE	FALSE	Apoptosis
c79241-g1 SLC47A1 (Solute carrier family 47 member) - emapper OG	NA	NA	FALSE	FALSE	Plasma membrane transporter
c99167-g1 1-to-1 SMARCB1 SWI/SNF related, matrix associated, actin dependent regulator of chromatin, subfamily	NA	NA	FALSE	FALSE	Regulation of cell cycle
c95824-g1 2-to-2 ASMT,ASMTL acetylserotonin O-methyltransferase	ASMT,ASMTL	ASMT,ASMTL	FALSE	FALSE	Metabolism
c104956-g1 1-to-1 SMG1 SMG1, nonsense mediated mRNA decay associated PI3K related kinase	NA	NA	FALSE	FALSE	RNA processing
c95900-g2 TICRR (TOPBP1-interacting checkpoint and replication regulator) - blastp	TICRR	TICRR	FALSE	FALSE	Regulation of cell cycle
c101038-g2 1-to-1 SMG5 SMG5, nonsense mediated mRNA decay factor	NA	NA	FALSE	FALSE	RNA processing
c103284-g4 4-to-2 SOAT2,SOAT1 sterol O-acyltransferase 2	NA	NA	FALSE	FALSE	Phospholipid signaling
c95961-g1 1-to-3 ARHGAP18,ARHGAP40,ARHGAP28 Rho GTPase activating protein 18	ARHGAP18,ARHGAP40,ARHGAP28	ARHGAP18,ARHGAP40,ARHGAP28	TRUE	TRUE	RhoA GTPase signaling
c95961-g1 1-to-3 ARHGAP18,ARHGAP40,ARHGAP28 Rho GTPase activating protein 18	ARHGAP18,ARHGAP40,ARHGAP28	ARHGAP18,ARHGAP40,ARHGAP28	TRUE	TRUE	Rho signaling
c96027-g1 SH2D4B (SH2 domain containing 4B) - blastp	SH2D4B	SH2D4B	FALSE	FALSE	Regulation of inflammation
c96056-g1 (glutamine synthetase) - emapper OG	glutaminesynthetase	glutaminesynthetase	FALSE	FALSE	Metabolism
c104244-g4 SOS2 (Son of sevenless homolog) - emapper OG	NA	NA	FALSE	FALSE	Ras GTPase signaling
c94607-g1 SPAC8C9.04, Schizosaccharomyces pombe (strain 972 ..	NA	NA	FALSE	FALSE	NO signaling
c89399-g2 SPECC1L (Sperm antigen with calponin homology and coiled-coil domains) - emapper OG	NA	NA	TRUE	FALSE	Actomyosin contractility
c89399-g2 SPECC1L (Sperm antigen with calponin homology and coiled-coil domains) - emapper OG	NA	NA	TRUE	FALSE	Regulation of adhesion complexes
c89399-g2 SPECC1L (Sperm antigen with calponin homology and coiled-coil domains) - emapper OG	NA	NA	TRUE	FALSE	Regulation of cytoskeleton at the membrane
c96196-g3 MPDZ (Multiple PDZ domain protein) - emapper OG	MPDZ	MPDZ	FALSE	FALSE	Regulation of adhesion complexes
c91461-g1 1-to-2 SPIRE2,SPIRE1 spire type actin nucleation factor 2	NA	NA	TRUE	FALSE	Actin dynamics
c91461-g1 1-to-2 SPIRE2,SPIRE1 spire type actin nucleation factor 2	NA	NA	TRUE	FALSE	Vesicular trafficking
c96307-g1 1-to-2 STK17B,STK17A serine/threonine kinase 17b	STK17B,STK17A	STK17B,STK17A	FALSE	FALSE	Apoptosis
c96316-g1 FLNB (Filamin A, alpha) - emapper OG	FLNB	FLNB	TRUE	FALSE	Actin dynamics
c96316-g1 FLNB (Filamin A, alpha) - emapper OG	FLNB	FLNB	TRUE	FALSE	Actomyosin contractility
c97367-g1 1-to-2 SRPK1,SRPK2 SRSF protein kinase 1	NA	NA	FALSE	FALSE	RNA processing
c102205-g1 1-to-1 SRPRA SRP receptor alpha subunit	NA	NA	FALSE	FALSE	Exocytosis
c96490-g1 SPAG1 (Sperm associated antigen 1) - emapper OG	SPAG1	SPAG1	FALSE	FALSE	Regulation of ciliary function
c101893-g1 1-to-1 SRRM2 serine/arginine repetitive matrix 2	NA	NA	FALSE	FALSE	RNA processing
c99508-g1 7-to-1 STARD9 StAR related lipid transfer domain containing 9	NA	NA	FALSE	FALSE	Microtubule dynamics
c96584-g1 1-to-3 KIF2B,KIF2C,KIF2A kinesin family member 2B	KIF2B,KIF2C,KIF2A	KIF2B,KIF2C,KIF2A	FALSE	FALSE	Microtubule dynamics
c96584-g1 1-to-3 KIF2B,KIF2C,KIF2A kinesin family member 2B	KIF2B,KIF2C,KIF2A	KIF2B,KIF2C,KIF2A	FALSE	FALSE	Vesicular trafficking
c96636-g1 1-to-1 LRRK2 leucine rich repeat kinase 2	LRRK2	LRRK2	FALSE	FALSE	Lysosomes
c96636-g1 1-to-1 LRRK2 leucine rich repeat kinase 2	LRRK2	LRRK2	FALSE	FALSE	Vesicular trafficking
c97737-g1 1-to-3 STK25,STK24,STK26 serine/threonine kinase 25	NA	NA	FALSE	FALSE	NO signaling
c97737-g1 1-to-3 STK25,STK24,STK26 serine/threonine kinase 25	NA	NA	FALSE	FALSE	Regulation of inflammation
c96684-g1 (intersectin 2) - emapper OG	intersectin2	intersectin2	TRUE	FALSE	Cdc42 GTPase signaling
c96684-g1 (intersectin 2) - emapper OG	intersectin2	intersectin2	TRUE	FALSE	Regulation of cytoskeleton at the membrane
c96684-g1 (intersectin 2) - emapper OG	intersectin2	intersectin2	TRUE	FALSE	Vesicular trafficking
c96684-g1 (intersectin 2) - emapper OG	intersectin2	intersectin2	TRUE	FALSE	Rho signaling
c96711-g1 1-to-2 MLXIP,MLXIPL MLX interacting protein	MLXIP,MLXIPL	MLXIP,MLXIPL	FALSE	FALSE	Metabolism
